{
  "schemaVersion": 1,
  "locale": "es-CL",
  "generatedAt": "2026-09-18T07:00:00-03:00",
  "publicationGate": "closed",
  "sections": {
    "essential": [{"storyId":"demo-local-service-001","slug":"demo-cambio-local-antes-de-salir","section":"essential","title":"Un cambio local que conviene conocer antes de salir","summary":"Resumen de demostración sobre un cambio de servicio con horario y alcance definidos.","contentClass":"official_source","publishedAt":"2026-09-18T09:40:00-03:00","geography":{"countryCode":"CL","regionName":"Región Metropolitana de Santiago","comunaName":"Vitacura","precision":"comuna"},"topic":"servicio_publico","source":{"label":"Fuente oficial de demostración","attribution":"Información de demostración, no corresponde a un aviso real.","sourceType":"official"},"actions":[{"kind":"follow_place","label":"Seguir Vitacura","target":"palta://place/comuna/vitacura/follow"},{"kind":"alerts","label":"Recibir avisos","target":"palta://place/comuna/vitacura/alerts"}],"correctionState":"none"}],
    "nearby": [{"storyId":"demo-road-001","slug":"demo-trabajos-viales-tramo-local","section":"nearby","title":"Trabajos viales en un tramo local durante la mañana","summary":"La futura nota mostrará tramo, horario y acceso al mapa solo cuando la ubicación esté verificada.","contentClass":"external_summary","publishedAt":"2026-09-18T09:20:00-03:00","geography":{"countryCode":"CL","regionName":"Región Metropolitana de Santiago","comunaName":"Vitacura","precision":"comuna"},"topic":"movilidad","source":{"label":"Fuente local de demostración","attribution":"Resumen ficticio utilizado para probar la interfaz.","sourceType":"local_media"},"actions":[{"kind":"map","label":"Ver en el mapa","target":"palta://map?context=demo-road-001"}]}],
    "chile": [],
    "local": [{"storyId":"demo-municipal-001","slug":"demo-horario-atencion-municipal","section":"local","title":"Cambia temporalmente un horario de atención municipal","summary":"Una noticia corta puede evitar un viaje innecesario y enlazar al trámite o servicio correspondiente.","contentClass":"official_source","publishedAt":"2026-09-17T18:10:00-03:00","geography":{"countryCode":"CL","regionName":"Región Metropolitana de Santiago","comunaName":"Vitacura","precision":"comuna"},"topic":"servicio_municipal","source":{"label":"Fuente oficial de demostración","attribution":"Contenido ficticio de prueba.","sourceType":"official"},"actions":[{"kind":"procedure","label":"Ver servicio","target":"palta://procedure/demo-municipal-001"}]}],
    "deep_dive": [{"storyId":"demo-deep-001","slug":"demo-cuando-un-problema-se-repite","section":"deep_dive","title":"Cuando un problema se repite, miramos qué hay detrás","summary":"Una estructura para separar hechos, patrones comprobables, explicaciones distintas y preguntas abiertas.","contentClass":"deep_dive","publishedAt":"2026-09-18T07:30:00-03:00","geography":{"countryCode":"CL","regionName":"Región Metropolitana de Santiago","precision":"region"},"topic":"vida_local","source":{"label":"Palta · demostración","attribution":"Plantilla editorial ficticia.","sourceType":"palta"},"actions":[{"kind":"community","label":"Conversar en Comunidad","target":"palta://community/topic/demo-deep-001"}]}],
    "voices": [{"storyId":"demo-voice-001","slug":"demo-entrevista-trabajo-local","section":"voices","title":"Aprendí a conocer el barrio por cómo cambia cada mañana","summary":"Entrevista ficticia para validar la separación entre experiencia personal y noticia factual.","contentClass":"local_voice","publishedAt":"2026-09-17T17:00:00-03:00","geography":{"countryCode":"CL","regionName":"Región Metropolitana de Santiago","comunaName":"Vitacura","precision":"comuna"},"topic":"voces_locales","source":{"label":"Colaborador de demostración","attribution":"Contenido ficticio de interfaz.","sourceType":"contributor"},"actions":[]}]
  }
}
